cache_key,found,query,track_name,artist_name,collection_name,preview_url,artwork_url,track_view_url,source
#3::aphex twin,True,#3 Aphex Twin Selected Ambient Works Volume II,#3,Aphex Twin,Selected Ambient Works Volume II (Expanded Edition),https://audio-ssl.itunes.apple.com/itunes-assets/AudioPreview221/v4/fb/90/3e/fb903ed1-86be-ba52-2e37-e763a36cc10e/mzaf_3048793810368732776.plus.aac.p.m4a,https://is1-ssl.mzstatic.com/image/thumb/Music221/v4/13/31/00/133100f5-78d4-696d-93a1-e5f312203249/5056614797756.png/600x600bb.jpg,https://music.apple.com/us/album/3/1749665545?i=1749665548&uo=4,itunes
1 true love::4*town (from disney and pixar鈥檚 turning red) jordan fisher finneas o'connell topher ngo grayson villanueva josh levi,False,1 True Love 4*TOWN (From Disney and Pixar鈥檚 Turning Red) Jordan Fisher Finneas O'Connell Topher Ngo Grayson Villanueva Josh Levi Turning Red (Original Motion Picture Soundtrack),,,,,,,itunes
100 years::five for fighting,True,100 Years Five For Fighting The Battle for Everything,100 Years,Five for Fighting,The Battle for Everything,https://audio-ssl.itunes.apple.com/itunes-assets/AudioPreview125/v4/98/5f/0b/985f0b23-721f-31ac-aeb3-b274018bcf6d/mzaf_12440629981191506443.plus.aac.p.m4a,https://is1-ssl.mzstatic.com/image/thumb/Music128/v4/63/63/f4/6363f4c1-35c6-428f-8f4d-0862ae3dd3ff/886446838458.jpg/600x600bb.jpg,https://music.apple.com/us/album/100-years/1303805264?i=1303807078&uo=4,itunes
100% of disin' u::armando,False,100% Of Disin' U Armando Trax Classix,,,,,,,itunes
12 weeks::huglord,False,12 Weeks huglord 12 Weeks,,,,,,,itunes
12:51::krissy & ericka,False,12:51 krissy & ericka Twelve: Fifty One (International Version),,,,,,,itunes
3 days in kadik枚y::matt large,False,3 Days in Kadik枚y Matt Large 3 Days in Kadik枚y,,,,,,,itunes
4 million ways - general midi mix::general midi,False,4 Million Ways - General Midi Mix General Midi 4 Million Ways,,,,,,,itunes
40 miles from denver::yonder mountain string band,False,40 Miles from Denver Yonder Mountain String Band Elevation,,,,,,,itunes
93 million miles::jason mraz,True,93 Million Miles Jason Mraz Love Is a Four Letter Word,93 Million Miles,Jason Mraz,Love Is a Four Letter Word (Deluxe Version),https://audio-ssl.itunes.apple.com/itunes-assets/AudioPreview211/v4/24/e1/ec/24e1ec92-ae06-5e34-198d-daf43f7e6137/mzaf_13274914157391185341.plus.aac.p.m4a,https://is1-ssl.mzstatic.com/image/thumb/Music115/v4/2c/ac/8a/2cac8ac4-cb90-ac44-0808-a8e3ccbe05d0/075679962577.jpg/600x600bb.jpg,https://music.apple.com/us/album/93-million-miles/509536557?i=509536634&uo=4,itunes
a bad dream that will pass away::luke howard,True,A Bad Dream That Will Pass Away Luke Howard A Bad Dream That Will Pass Away,A Bad Dream That Will Pass Away,Luke Howard,A Bad Dream That Will Pass Away - Single,https://audio-ssl.itunes.apple.com/itunes-assets/AudioPreview221/v4/72/0a/b6/720ab6f7-7ddb-ec64-171f-6d8d9d84af33/mzaf_8305679694943105412.plus.aac.p.m4a,https://is1-ssl.mzstatic.com/image/thumb/Music116/v4/cf/21/bd/cf21bd07-3522-27d5-f294-095fedd2f651/22UMGIM09730.rgb.jpg/600x600bb.jpg,https://music.apple.com/us/album/a-bad-dream-that-will-pass-away/1612739169?i=1612739185&uo=4,itunes
a dream is a wish your heart makes::disney peaceful piano disney,False,A Dream Is a Wish Your Heart Makes Disney Peaceful Piano Disney Disney Peaceful Piano: Lullaby,,,,,,,itunes
a drop in the ocean::ron pope,True,A Drop in the Ocean Ron Pope The Bedroom Demos,A Drop In the Ocean,Ron Pope,The Bedroom Demos,https://audio-ssl.itunes.apple.com/itunes-assets/AudioPreview125/v4/48/0c/86/480c866c-e9b6-9136-d6ca-67455e02dfd1/mzaf_17343118284428797380.plus.aac.p.m4a,https://is1-ssl.mzstatic.com/image/thumb/Music/34/5f/35/mzi.omywmuag.jpg/600x600bb.jpg,https://music.apple.com/us/album/a-drop-in-the-ocean/284443933?i=284443941&uo=4,itunes
a letter to seymour::greensky bluegrass,False,A Letter to Seymour Greensky Bluegrass If Sorrows Swim,,,,,,,itunes
a long way::ensidya,False,A Long Way Ensidya A Long Way,,,,,,,itunes
a media luz - remastered::carlos gardel,False,A Media Luz - Remastered Carlos Gardel Selecci贸n Especial (Remastered),,,,,,,itunes
a rosa e o beija flor::yury press茫o,False,A Rosa E O Beija Flor Yury Press茫o De Gera莽茫o Pra Gera莽茫o,,,,,,,itunes
a ro莽a ou a cidade (da ro莽a pra cidade) - ao vivo::os bar玫es da pisadinha,False,A Ro莽a ou a Cidade (Da Ro莽a Pra Cidade) - Ao Vivo Os Bar玫es Da Pisadinha A Ro莽a ou a Cidade (Da Ro莽a Pra Cidade) [Ao Vivo],,,,,,,itunes
a short break::sail & weep,False,A short break Sail & Weep A short break,,,,,,,itunes
a star is born::cheryl freeman lachanze vaneese thomas lillias white roz ryan disney,False,A Star Is Born Cheryl Freeman LaChanze Vaneese Thomas Lillias White Roz Ryan Disney Hercules (Original Motion Picture Soundtrack),,,,,,,itunes
abre los ojos::germaine franco,False,Abre Los Ojos Germaine Franco Encanto (Original Motion Picture Soundtrack),,,,,,,itunes
acid thunder::fast eddie,False,Acid Thunder Fast Eddie Jack to the Sound,,,,,,,itunes
acid tracks::phuture,False,Acid Tracks Phuture Acid Tracks,,,,,,,itunes
affection::cigarettes after sex,True,Affection Cigarettes After Sex Affection,Keep on Loving You,Cigarettes After Sex,Affection - Single,https://audio-ssl.itunes.apple.com/itunes-assets/AudioPreview128/v4/b6/c1/4c/b6c14c5c-7458-45cf-51ae-748acaac43af/mzaf_4277202337430779673.plus.aac.p.m4a,https://is1-ssl.mzstatic.com/image/thumb/Music211/v4/2f/8b/0f/2f8b0f19-8a25-b331-c52a-de8ec18b90d1/859715999853_Cover.jpg/600x600bb.jpg,https://music.apple.com/us/album/keep-on-loving-you/1266085857?i=1266085860&uo=4,itunes
afraid::the neighbourhood,True,Afraid The Neighbourhood I Love You.,Leaving Tonight,The Neighbourhood,I Love You. (10th Anniversary Edition),https://audio-ssl.itunes.apple.com/itunes-assets/AudioPreview211/v4/90/ac/d7/90acd7dd-83dc-db82-09a9-2a3df55c47f2/mzaf_16845725258812983008.plus.aac.p.m4a,https://is1-ssl.mzstatic.com/image/thumb/Music126/v4/2f/8c/90/2f8c903f-6e84-b820-3ab6-d9ec0044267a/196871038430.jpg/600x600bb.jpg,https://music.apple.com/us/album/leaving-tonight/1682583963?i=1682584242&uo=4,itunes
after surf sandwich::breakfast for brunch,False,After Surf Sandwich Breakfast For Brunch Post It Beats Pt.1,,,,,,,itunes
agatha all along::kristen anderson-lopez robert lopez kathryn hahn eric bradley greg whipple jasper randall gerald white,False,Agatha All Along Kristen Anderson-Lopez Robert Lopez Kathryn Hahn Eric Bradley Greg Whipple Jasper Randall Gerald White WandaVision: Episode 7 (Original Soundtrack),,,,,,,itunes
agora estou sofrendo::calcinha preta gusttavo lima,False,Agora Estou Sofrendo Calcinha Preta Gusttavo Lima Agora Estou Sofrendo (Ao Vivo),,,,,,,itunes
agora::pablo,False,Agora Pablo 脡 S贸 Dizer Que Sim,,,,,,,itunes
aguante bonavena::almafuerte,False,Aguante Bonavena Almafuerte A Fondo Blanco,,,,,,,itunes
ain't no grave (sparse)::crooked still aoife o'donovan,False,Ain't No Grave (Sparse) Crooked Still Aoife O'Donovan Ain't No Grave,,,,,,,itunes
ain't no grave::crooked still,False,Ain't No Grave Crooked Still Shaken By A Low Sound,,,,,,,itunes
ain't talkin' 'bout dub::apollo 440,False,Ain't Talkin' 'Bout Dub Apollo 440 Electro Glide In Blue,,,,,,,itunes
ainda h谩 tempo::criolo,False,Ainda H谩 Tempo Criolo Ainda H谩 Tempo,,,,,,,itunes
al mundo le falta un tornillo::edmundo rivero orquesta de horacio salg谩n,False,Al Mundo Le Falta un Tornillo Edmundo Rivero Orquesta de Horacio Salg谩n Great Voices of Tango,,,,,,,itunes
al mundo le falta un tornillo::julio sosa armando pontier,False,Al Mundo Le Falta un Tornillo Julio Sosa Armando Pontier Tango Classics 180: La Ultima Copa,,,,,,,itunes
ala::joep beving,True,Ala Joep Beving Trilogy,Ala,Joep Beving,Trilogy,https://audio-ssl.itunes.apple.com/itunes-assets/AudioPreview125/v4/bd/c0/41/bdc04160-43d3-8721-078c-8ea4bc611b1a/mzaf_6626988805368407475.plus.aac.p.m4a,https://is1-ssl.mzstatic.com/image/thumb/Music125/v4/6f/fd/6c/6ffd6cf8-db9f-db28-e8fa-8a11300d1247/21UMGIM64392.rgb.jpg/600x600bb.jpg,https://music.apple.com/us/album/ala/1579499802?i=1579500871&uo=4,itunes
all i need (feat. beth hirsch)::air beth hirsch,True,All I Need (feat. Beth Hirsch) Air Beth Hirsch Moon Safari,All I Need (feat. Beth Hirsch) [Vegyn Version],Air,Blue Moon Safari,https://audio-ssl.itunes.apple.com/itunes-assets/AudioPreview211/v4/e1/b4/cd/e1b4cd98-d3af-8459-675c-9d2510aaed3c/mzaf_4921691683790839279.plus.aac.p.m4a,https://is1-ssl.mzstatic.com/image/thumb/Music211/v4/c3/ce/a4/c3cea432-cc27-3a83-78b2-0e3210787063/5021732744036.jpg/600x600bb.jpg,https://music.apple.com/us/album/all-i-need-feat-beth-hirsch-vegyn-version/1806143718?i=1806144055&uo=4,itunes
all is found::disney peaceful piano disney,False,All Is Found Disney Peaceful Piano Disney Disney Peaceful Piano: Breathe,,,,,,,itunes
all or nothing::datsik,False,All Or Nothing Datsik Let It Burn,,,,,,,itunes
all star::smash mouth,False,All Star Smash Mouth Astro Lounge,,,,,,,itunes
allt finns kvar::eleonora feldt,False,Allt finns kvar Eleonora Feldt Allt finns kvar,,,,,,,itunes
almost lover::a fine frenzy,False,Almost Lover A Fine Frenzy One Cell In The Sea,,,,,,,itunes
already gone::sleeping at last,True,"Already Gone Sleeping At Last Covers, Vol. 2",Already Gone,Sleeping At Last,"Covers, Vol. 2",https://audio-ssl.itunes.apple.com/itunes-assets/AudioPreview221/v4/5f/49/2e/5f492e6d-9e13-26f4-386c-a242b9669e3a/mzaf_3839810278628139858.plus.aac.p.m4a,https://is1-ssl.mzstatic.com/image/thumb/Music221/v4/92/4d/70/924d705b-3458-fd54-fe62-fd8a7f6d87ed/859718573654_cover.jpg/600x600bb.jpg,https://music.apple.com/us/album/already-gone/1167324661?i=1167324920&uo=4,itunes
alta esta莽茫o::avi玫es do forr贸,False,"Alta Esta莽茫o Avi玫es do Forr贸 Avi玫es do Forr贸, Vol. 3",,,,,,,itunes
al么 ex amor::humberto & ronaldo,False,Al么 Ex Amor Humberto & Ronaldo Al么 Ex Amor,,,,,,,itunes
amamos la vida::accept,False,Amamos La Vida Accept Objection Overruled,,,,,,,itunes
"amante, amiga e namorada - ao vivo::max e luan",False,"Amante, Amiga e Namorada - Ao Vivo Max e Luan Esqueminha (Ao Vivo)",,,,,,,itunes
american beauty::drew holcomb & the neighbors,False,American Beauty Drew Holcomb & The Neighbors Medicine,,,,,,,itunes
anatomy of change::oto roth,False,Anatomy of Change Oto Roth Anatomy of Change,,,,,,,itunes
anbessa::akal茅 wub茅 manu dibango,False,Anbessa Akal茅 Wub茅 Manu Dibango Sost,,,,,,,itunes
anchor::novo amor,True,Anchor Novo Amor Bathing Beach,Anchor,Novo Amor,Bathing Beach - EP,https://audio-ssl.itunes.apple.com/itunes-assets/AudioPreview116/v4/36/2f/c8/362fc812-1ab6-e7b7-ba85-03697ceb8246/mzaf_14649291434556829701.plus.aac.p.m4a,https://is1-ssl.mzstatic.com/image/thumb/Music116/v4/54/4b/e1/544be1ff-5505-56dc-2720-96da95313a8e/cover.jpg/600x600bb.jpg,https://music.apple.com/us/album/anchor/1672226910?i=1672227410&uo=4,itunes
anchor::rob scallon,False,Anchor Rob Scallon Anchor EP (Tour Edition),,,,,,,itunes
anclao en par铆s::sandra luna juan esteban cuacci,False,Anclao en Par铆s Sandra Luna Juan Esteban Cuacci Solos,,,,,,,itunes
and i love her::kurt cobain,True,And I Love Her Kurt Cobain Montage Of Heck: The Home Recordings,And I Love Her,Kurt Cobain,Montage of Heck: The Home Recordings (Deluxe Soundtrack),https://audio-ssl.itunes.apple.com/itunes-assets/AudioPreview115/v4/a8/e9/d8/a8e9d8dc-aa60-eee8-ae7a-b15c3f02c858/mzaf_3681668398348665042.plus.aac.p.m4a,https://is1-ssl.mzstatic.com/image/thumb/Music125/v4/d6/c3/db/d6c3db6c-8fa0-2132-f323-41ffe66fed3f/00602547607089.rgb.jpg/600x600bb.jpg,https://music.apple.com/us/album/and-i-love-her/1443299811?i=1443301113&uo=4,itunes
and so i dance::larry heard,False,"And So I Dance Larry Heard Dance 2000, Part 2",,,,,,,itunes
angel delight::jimmy lite hands,False,Angel Delight Jimmy Lite Hands Angel Delight,,,,,,,itunes
angelina::tommy emmanuel,False,Angelina Tommy Emmanuel Endless Road,,,,,,,itunes
angels we have heard on high (remastered 2014)::traditional royal philharmonic orchestra,False,"Angels We Have Heard on High (Remastered 2014) Traditional Royal Philharmonic Orchestra Classical Christmas, Vol. 1",,,,,,,itunes
answers::elmer loyd,False,Answers Elmer Loyd Answers,,,,,,,itunes
antiguo reloj de cobre::miguel montero,False,Antiguo Reloj De Cobre Miguel Montero Antiguo Reloj De Cobre,,,,,,,itunes
apelido carinhoso::silvanno salles,False,Apelido Carinhoso Silvanno Salles Volume 22,,,,,,,itunes
apocalypse::cigarettes after sex,False,Apocalypse Cigarettes After Sex Cigarettes After Sex,,,,,,,itunes
apodado hijo del diablo::mastifal,False,Apodado hijo del diablo Mastifal Holocausto Mental (Remastered),,,,,,,itunes
appreciation::vishal casey,False,Appreciation Vishal Casey Appreciation,,,,,,,itunes
apricots::bicep,True,Apricots Bicep Isles,Apricots,Bicep,Isles,https://audio-ssl.itunes.apple.com/itunes-assets/AudioPreview211/v4/83/2b/11/832b11e1-39a9-5c0f-4228-daf2dbf905ef/mzaf_12949471302064985695.plus.aac.p.m4a,https://is1-ssl.mzstatic.com/image/thumb/Music116/v4/69/12/b0/6912b05d-b728-f9f6-cb2b-ba99082c9123/5054429139228.png/600x600bb.jpg,https://music.apple.com/us/album/apricots/1531704818?i=1531704822&uo=4,itunes
aquarius/let the sunshine in (the flesh failures)::the 5th dimension,False,Aquarius/Let the Sunshine In (The Flesh Failures) The 5th Dimension,,,,,,,itunes
are and be::wavcrush,False,are and be wavcrush pair of dice,,,,,,,itunes
are you lonesome tonight?::elvis presley,False,Are You Lonesome Tonight? Elvis Presley,,,,,,,itunes
arlington::the wailin' jennys,False,Arlington The Wailin' Jennys 40 Days,,,,,,,itunes
arrabalera::tita merello,False,Arrabalera Tita Merello Tita De Buenos Aires,,,,,,,itunes
asan ka na ba::zack tabudlo,True,Asan Ka Na Ba Zack Tabudlo Asan Ka Na Ba,Asan Ka Na Ba,Zack Tabudlo,Asan Ka Na Ba - Single,https://audio-ssl.itunes.apple.com/itunes-assets/AudioPreview122/v4/cf/be/4c/cfbe4c0a-cb6c-4ed3-c7ac-b0ef80d90014/mzaf_9366519993627105075.plus.aac.p.m4a,https://is1-ssl.mzstatic.com/image/thumb/Music126/v4/24/2d/82/242d821a-083a-424c-8a66-a62938d791fb/22UMGIM27042.rgb.jpg/600x600bb.jpg,https://music.apple.com/us/album/asan-ka-na-ba/1614444268?i=1614444270&uo=4,itunes
atravesando todo limite::hermetica,False,Atravesando Todo Limite Hermetica Acido Argentino,,,,,,,itunes
atr茅vete-te-te::calle 13,False,Atr茅vete-Te-Te Calle 13 Calle 13 (Explicit Version),,,,,,,itunes
ave de paso::charlo,False,Ave de Paso Charlo Oro y Plata,,,,,,,itunes
avril 14th::aphex twin,True,Avril 14th Aphex Twin Drukqs,Avril 14th,Aphex Twin,Drukqs,https://audio-ssl.itunes.apple.com/itunes-assets/AudioPreview126/v4/13/09/1f/13091fd5-ef8e-a494-5c36-61a133cfdc19/mzaf_1097252554933139566.plus.aac.p.m4a,https://is1-ssl.mzstatic.com/image/thumb/Music124/v4/40/7f/bc/407fbccc-1361-4425-972b-0d60018a752f/mzi.vbkjoksk.jpg/600x600bb.jpg,https://music.apple.com/us/album/avril-14th/282559693?i=282559791&uo=4,itunes
b61::aoife o'donovan,False,B61 Aoife O'Donovan B61,,,,,,,itunes
baby's got a temper - main mix::the prodigy,False,Baby's Got a Temper - Main Mix The Prodigy Baby's Got a Temper,,,,,,,itunes
"bahama breeze::sarah, the illstrumentalist",False,"Bahama Breeze Sarah, the Illstrumentalist Discover the World Vol. 1",,,,,,,itunes
balada para un loco::roberto goyeneche astor piazzolla,False,Balada para un Loco Roberto Goyeneche Astor Piazzolla Roberto Goyeneche - RCA Victor 100 A帽os,,,,,,,itunes
balan莽a o celtinha::jap茫ozin,False,Balan莽a o Celtinha Jap茫ozin Brabo dos Pared玫es,,,,,,,itunes
baldosa floja::juan d'arienzo mario bustos jorge valdez,False,Baldosa floja Juan D'Arienzo Mario Bustos Jorge Valdez Tango Classics 084: Milonga del recuerdo,,,,,,,itunes
balls to the wall::accept,False,Balls to the Wall Accept Balls To The Wall,,,,,,,itunes
bandoneon arrabalero::roberto goyeneche,False,Bandoneon Arrabalero Roberto Goyeneche Roberto Goyeneche: Cantor de Mi Barrio,,,,,,,itunes
barry's bounce::andy thorn,False,Barry's Bounce Andy Thorn Songs of the Sunrise Fox,,,,,,,itunes
basta voc锚 me ligar - ao vivo::os bar玫es da pisadinha xand avi茫o,False,Basta Voc锚 Me Ligar - Ao Vivo Os Bar玫es Da Pisadinha Xand Avi茫o Conquistas (Ao Vivo),,,,,,,itunes
be that hope::hope mona,False,be that hope hope mona there's always hope,,,,,,,itunes
beast in black::beast in black,False,Beast in Black Beast In Black Berserker,,,,,,,itunes
beat soup::beat oven,False,Beat Soup Beat Oven Beat Soup,,,,,,,itunes
beat the bastards::accept,False,Beat the Bastards Accept Blood of the Nations,,,,,,,itunes
beatific::caius biel,False,Beatific Caius Biel Beatific,,,,,,,itunes
beautiful dreamer::sara watkins,False,Beautiful Dreamer Sara Watkins Under the Pepper Tree,,,,,,,itunes
beautiful imagination::little circuits,False,Beautiful Imagination Little Circuits Beautiful Imagination,,,,,,,itunes
beautiful people - obsk眉r remix::barbara tucker obsk眉r,False,Beautiful People - Obsk眉r Remix Barbara Tucker Obsk眉r Beautiful People (Obsk眉r Remix),,,,,,,itunes
beauty and the beast - arr. for piano::andy tallent,False,Beauty and the Beast - Arr. for Piano Andy Tallent Wishes,,,,,,,itunes
beauty and the beast::disney peaceful piano disney,False,Beauty and the Beast Disney Peaceful Piano Disney Disney Peaceful Piano: Lullaby,,,,,,,itunes
becalming::rebecka aether,False,Becalming Rebecka Aether Becalming,,,,,,,itunes
beijo do vampiro - ao vivo::os bar玫es da pisadinha wesley safad茫o,False,Beijo do Vampiro - Ao Vivo Os Bar玫es Da Pisadinha Wesley Safad茫o Da Ro莽a Pra Cidade (Ao Vivo),,,,,,,itunes
belfast - yotto remix::orbital yotto,False,Belfast - Yotto Remix Orbital Yotto Belfast (Yotto Remix),,,,,,,itunes
belfast::orbital,False,Belfast Orbital Orbital,,,,,,,itunes
belle::emma watson luke evans ensemble - beauty and the beast,False,Belle Emma Watson Luke Evans Ensemble - Beauty and the Beast Beauty and the Beast (Original Motion Picture Soundtrack/Deluxe Edition),,,,,,,itunes
bentley's gonna sort you out::bentley rhythm ace,False,Bentley's Gonna Sort You Out Bentley Rhythm Ace 90s Dance Anthems,,,,,,,itunes
bespechnyy angel::aria,False,"Bespechnyy angel Aria Legendy russkogo roka: Arija, Ch. 2",,,,,,,itunes
better together::us the duo,False,Better Together Us The Duo Better Together,,,,,,,itunes
between the lines::wasted glitter,False,Between The Lines Wasted Glitter Between The Lines,,,,,,,itunes
beyond desolation::gustavo santaolalla,True,Beyond Desolation Gustavo Santaolalla The Last of Us Part II (Original Soundtrack),Beyond Desolation,Gustavo Santaolalla,The Last of Us Part II (Original Soundtrack),https://audio-ssl.itunes.apple.com/itunes-assets/AudioPreview125/v4/c0/24/69/c02469a9-dd0c-3ace-f05c-fb18b9766188/mzaf_6584403431223010226.plus.aac.p.m4a,https://is1-ssl.mzstatic.com/image/thumb/Music124/v4/95/ff/8b/95ff8bf2-31fd-3c7f-5f07-f1dcb1a3af73/886448542469.jpg/600x600bb.jpg,https://music.apple.com/us/album/beyond-desolation/1517883607?i=1517883745&uo=4,itunes
"bibbidi-bobbidi-boo - from ""cinderella""::verna felton",False,"Bibbidi-Bobbidi-Boo - From ""Cinderella"" Verna Felton Disney's Greatest Volume 1",,,,,,,itunes
big four::big four,False,Big Four Big Four The Big Hits Big Four,,,,,,,itunes
big hunk o' love::elvis presley,False,Big Hunk o' Love Elvis Presley,,,,,,,itunes
"bilu, bilu::pablo",False,"Bilu, Bilu Pablo 脡 S贸 Dizer Que Sim",,,,,,,itunes
binibini::zack tabudlo,True,Binibini Zack Tabudlo Binibini,Binibini,Zack Tabudlo,Binibini - Single,https://audio-ssl.itunes.apple.com/itunes-assets/AudioPreview114/v4/f2/de/aa/f2deaa17-95d5-c05b-b006-2b926c55af76/mzaf_2522134679866978109.plus.aac.p.m4a,https://is1-ssl.mzstatic.com/image/thumb/Music115/v4/5b/6f/1b/5b6f1bd5-d0de-b26d-e584-54517791896c/21UMGIM17512.rgb.jpg/600x600bb.jpg,https://music.apple.com/us/album/binibini/1557994017?i=1557994025&uo=4,itunes
biomes::james heather,True,Biomes James Heather Stories From Far Away On Piano,Biomes,James Heather,Stories from Far Away on Piano,https://audio-ssl.itunes.apple.com/itunes-assets/AudioPreview221/v4/31/70/9c/31709c9d-d09b-b01f-e2a8-af9897c985ae/mzaf_5908931007303567302.plus.aac.p.m4a,https://is1-ssl.mzstatic.com/image/thumb/Music112/v4/e0/9a/d0/e09ad051-66bb-9d66-aa23-65ed08930980/5054429119930.png/600x600bb.jpg,https://music.apple.com/us/album/biomes/1247977952?i=1247978116&uo=4,itunes
bitter sweet symphony::the verve,False,Bitter Sweet Symphony The Verve Urban Hymns (Remastered 2016),,,,,,,itunes
black hole sun::soundgarden,True,Black Hole Sun Soundgarden Superunknown (Deluxe Edition),Black Hole Sun,Soundgarden,Superunknown (Deluxe Edition),https://audio-ssl.itunes.apple.com/itunes-assets/AudioPreview211/v4/c3/7c/32/c37c32b4-b95d-1714-a205-4848458c0ba1/mzaf_7576631968114037271.plus.aac.p.m4a,https://is1-ssl.mzstatic.com/image/thumb/Music115/v4/69/60/2e/69602e04-f483-70a7-51b6-5dc6b58273ce/00602537879830.rgb.jpg/600x600bb.jpg,https://music.apple.com/us/album/black-hole-sun/1440855214?i=1440855436&uo=4,itunes
black horse and the cherry tree::kt tunstall,True,Black Horse And The Cherry Tree KT Tunstall Eye To The Telescope,Black Horse and the Cherry Tree (Radio Version),KT Tunstall,Eye To the Telescope,https://audio-ssl.itunes.apple.com/itunes-assets/AudioPreview221/v4/cb/1c/77/cb1c77cb-9da2-9d05-6852-f6241bf727cb/mzaf_7071967096657706025.plus.aac.p.m4a,https://is1-ssl.mzstatic.com/image/thumb/Music124/v4/ca/c4/b7/cac4b7d8-a7e9-c2e6-813d-d32ec271c322/00094635541052.rgb.jpg/600x600bb.jpg,https://music.apple.com/us/album/black-horse-and-the-cherry-tree-radio-version/724692632?i=724693243&uo=4,itunes
black white felt::roedelius arnold kasar,True,Black White Felt Roedelius Arnold Kasar Einfluss,Black White Felt,Roedelius & Arnold Kasar,Einfluss,https://audio-ssl.itunes.apple.com/itunes-assets/AudioPreview211/v4/68/11/5d/68115d7d-f2fa-1395-66a1-7066918254ff/mzaf_10331711575490956344.plus.aac.p.m4a,https://is1-ssl.mzstatic.com/image/thumb/Music114/v4/83/5d/34/835d3438-3196-34aa-9995-60cc8f1bab81/17UMGIM06545.rgb.jpg/600x600bb.jpg,https://music.apple.com/us/album/black-white-felt/1452331519?i=1452332056&uo=4,itunes
blade runner::beast in black,False,Blade Runner Beast In Black Dark Connection,,,,,,,itunes
blanket of white::sleepy clouds,False,Blanket of White Sleepy Clouds Elevated,,,,,,,itunes
blind and frozen::beast in black,False,Blind and Frozen Beast In Black Berserker,,,,,,,itunes
blister in the sun::violent femmes,True,Blister In The Sun Violent Femmes Violent Femmes,Blister In The Sun,Violent Femmes,Violent Femmes,https://audio-ssl.itunes.apple.com/itunes-assets/AudioPreview115/v4/33/d0/88/33d088db-65e3-ea70-e8a5-e0d19774ddf2/mzaf_12883542085691579801.plus.aac.p.m4a,https://is1-ssl.mzstatic.com/image/thumb/Music125/v4/92/ba/7f/92ba7f8c-77f0-23d2-fbcb-6617785f940e/18CRGIM06158.rgb.jpg/600x600bb.jpg,https://music.apple.com/us/album/blister-in-the-sun/1576789411?i=1576789643&uo=4,itunes
block rockin' beats::the chemical brothers,False,Block Rockin' Beats The Chemical Brothers Brotherhood,,,,,,,itunes
blue sphere::sea of waves,False,Blue Sphere Sea of Waves Blue Sphere,,,,,,,itunes
boquinha::marcynho sensa莽茫o,False,Boquinha Marcynho Sensa莽茫o E 脡 uma Banda 脡?,,,,,,,itunes
born again::beast in black,False,Born Again Beast In Black Berserker,,,,,,,itunes
boston::augustana,False,Boston Augustana All The Stars and Boulevards,,,,,,,itunes
bota pra torar::pisadinha do vaqueiro,False,Bota pra Torar Pisadinha do Vaqueiro Na Pegada do Vaqueiro,,,,,,,itunes
bra::cymande,False,Bra Cymande Cymande,,,,,,,itunes
brand new::ben rector,False,Brand New Ben Rector Brand New,,,,,,,itunes
brave::sara bareilles,True,Brave Sara Bareilles The Blessed Unrest,Brave,Sara Bareilles,The Blessed Unrest,https://audio-ssl.itunes.apple.com/itunes-assets/AudioPreview115/v4/b9/9c/53/b99c539d-32eb-8ddb-4701-e23292ce0d06/mzaf_7251595647808145863.plus.aac.p.m4a,https://is1-ssl.mzstatic.com/image/thumb/Music124/v4/8e/6d/82/8e6d82f3-b795-d68a-ecba-aebeec214b22/886443982444.jpg/600x600bb.jpg,https://music.apple.com/us/album/brave/1440504715?i=1440504730&uo=4,itunes
brazil::declan mckenna,False,Brazil Declan McKenna What Do You Think About the Car?,,,,,,,itunes
breathe (2 am)::anna nalick,False,Breathe (2 AM) Anna Nalick Wreck of the Day,,,,,,,itunes
breathe (feat. rza) [liam h and rene lavice re-amp]::the prodigy rza ren茅 lavice,False,Breathe (feat. RZA) [Liam H and Rene LaVice Re-Amp] The Prodigy RZA Ren茅 LaVice Breathe (feat. RZA) [Liam H and Rene LaVice Re-Amp],,,,,,,itunes
breathe::the prodigy,False,Breathe The Prodigy The Fat of the Land,,,,,,,itunes
brighter days - dajae- underground mix '93::cajmere dajae,False,Brighter Days - Dajae- Underground Mix '93 Cajmere Dajae It's Time,,,,,,,itunes
brincou de amor::iguinho e lulinha,False,Brincou de Amor Iguinho e Lulinha Simbora pra Vaquejada,,,,,,,itunes
broken::lovelytheband,True,broken lovelytheband finding it hard to smile,Broken,lovelytheband,Finding It Hard to Smile,https://audio-ssl.itunes.apple.com/itunes-assets/AudioPreview115/v4/a0/2c/11/a02c1120-78ad-d1e6-1c94-1c3e2f3730c6/mzaf_3219980609790085368.plus.aac.p.m4a,https://is1-ssl.mzstatic.com/image/thumb/Music115/v4/ae/17/49/ae1749db-712c-0c2a-5d13-a7747417d15e/886447104675.jpg/600x600bb.jpg,https://music.apple.com/us/album/broken/1396231359?i=1396231367&uo=4,itunes
brooklyn::lazy leopard,False,Brooklyn Lazy Leopard Brooklyn,,,,,,,itunes
brothers on the slide::cymande,False,Brothers On The Slide Cymande Promised Heights,,,,,,,itunes
brothers unite::brothers of metal,False,Brothers Unite Brothers of Metal Emblas Saga,,,,,,,itunes
brown noise hollow 180 hz::granular,False,Brown Noise Hollow 180 hz Granular Brown Noise DLX,,,,,,,itunes
brown sleep noise::sleep miracle,False,Brown Sleep Noise Sleep Miracle Brown Sleep Noise,,,,,,,itunes
