cache_key,found,query,track_name,artist_name,collection_name,preview_url,artwork_url,track_view_url,source
stargazing::the neighbourhood,True,Stargazing The Neighbourhood Chip Chrome & The Mono-Tones (Deluxe),Stargazing,The Neighbourhood,Chip Chrome & The Mono-Tones (Deluxe),https://audio-ssl.itunes.apple.com/itunes-assets/AudioPreview115/v4/ee/42/3b/ee423b58-eeb3-ac66-39ec-8779881a7fc9/mzaf_1839713026899454249.plus.aac.p.m4a,https://is1-ssl.mzstatic.com/image/thumb/Music115/v4/36/40/a5/3640a5e1-9796-6ada-b273-75817d113f29/886448909538.jpg/600x600bb.jpg,https://music.apple.com/us/album/stargazing/1541400529?i=1541400545&uo=4,itunes
starry eyes::cigarettes after sex,True,Starry Eyes Cigarettes After Sex EP I.,Starry Eyes,Cigarettes After Sex,I. - EP,https://audio-ssl.itunes.apple.com/itunes-assets/AudioPreview128/v4/51/c2/fd/51c2fd16-b7ab-cd04-3526-2f11c3b8ed0d/mzaf_5950677792245668156.plus.aac.p.m4a,https://is1-ssl.mzstatic.com/image/thumb/Music211/v4/9a/eb/1c/9aeb1c86-7dd7-b31e-9a40-e26a1ae38d89/720841228202_Cover.jpg/600x600bb.jpg,https://music.apple.com/us/album/starry-eyes/1266067531?i=1266067539&uo=4,itunes
state lines::novo amor,True,State Lines Novo Amor Birthplace,State Lines,Novo Amor,Birthplace,https://audio-ssl.itunes.apple.com/itunes-assets/AudioPreview126/v4/3a/92/5f/3a925fef-9a64-c359-810d-43254f164d81/mzaf_13009926056360226427.plus.aac.p.m4a,https://is1-ssl.mzstatic.com/image/thumb/Music116/v4/bd/ea/99/bdea99d7-53ce-031d-ea40-14ccac5096e7/cover.jpg/600x600bb.jpg,https://music.apple.com/us/album/state-lines/1672227185?i=1672228355&uo=4,itunes
stickwithit::recaps,False,Stickwithit Recaps Stickwithit,,,,,,,itunes
stop the rock - apollo 440 mix::apollo 440,False,Stop the Rock - Apollo 440 Mix Apollo 440 Gettin' High On Your Own Supply,,,,,,,itunes
stories::rebecka aether,False,Stories Rebecka Aether Stories,,,,,,,itunes
strummer boy::dusty decks,False,Strummer Boy Dusty Decks RPM,,,,,,,itunes
such a simple thing::ray lamontagne,False,Such A Simple Thing Ray LaMontagne Part Of The Light,,,,,,,itunes
sucrilhos::criolo,False,Sucrilhos Criolo N贸 na Orelha,,,,,,,itunes
suddenly i see::kt tunstall,True,Suddenly I See KT Tunstall Eye To The Telescope,Suddenly I See,KT Tunstall,Eye To the Telescope,https://audio-ssl.itunes.apple.com/itunes-assets/AudioPreview211/v4/79/14/8b/79148bde-9cc2-f8af-38a7-ecfc03ae8e2c/mzaf_9861477074729670191.plus.aac.p.m4a,https://is1-ssl.mzstatic.com/image/thumb/Music124/v4/ca/c4/b7/cac4b7d8-a7e9-c2e6-813d-d32ec271c322/00094635541052.rgb.jpg/600x600bb.jpg,https://music.apple.com/us/album/suddenly-i-see/724692632?i=724693357&uo=4,itunes
sunsetz::cigarettes after sex,False,Sunsetz Cigarettes After Sex Cigarettes After Sex,,,,,,,itunes
superman (it's not easy)::five for fighting,True,Superman (It's Not Easy) Five For Fighting America Town,Superman (It's Not Easy),Five for Fighting,America Town,https://audio-ssl.itunes.apple.com/itunes-assets/AudioPreview211/v4/47/b6/87/47b68784-fe51-8f0a-7b29-dbb231609353/mzaf_12168401166112931940.plus.aac.p.m4a,https://is1-ssl.mzstatic.com/image/thumb/Music125/v4/b7/5f/70/b75f7026-5256-f116-b138-a9a72cb81e32/mzi.hmcmmgis.jpg/600x600bb.jpg,https://music.apple.com/us/album/superman-its-not-easy/395769124?i=395769132&uo=4,itunes
supermoves::overseer,False,Supermoves Overseer Wreckage,,,,,,,itunes
supersonic (vip)::noisia skrillex josh pan dylan brady,False,Supersonic (VIP) Noisia Skrillex josh pan Dylan Brady Horizon (with Noisia),,,,,,,itunes
sur::an铆bal troilo y su orquesta t铆pica roberto goyeneche,False,Sur An铆bal Troilo Y Su Orquesta T铆pica Roberto Goyeneche 15 Grandes Exitos - Los Discos De Oro De Roberto Goyeneche,,,,,,,itunes
svanur (feat. r枚kkurr贸)::fejk谩 r枚kkurr贸,False,Svanur (feat. R枚kkurr贸) Fejk谩 R枚kkurr贸,,,,,,,itunes
sweater weather::the neighbourhood,False,Sweater Weather The Neighbourhood I Love You.,,,,,,,itunes
sweet true lies::beast in black,False,Sweet True Lies Beast In Black From Hell with Love,,,,,,,itunes
sweet::cigarettes after sex,True,Sweet Cigarettes After Sex Cigarettes After Sex,Sweet,Cigarettes After Sex,Cigarettes After Sex,https://audio-ssl.itunes.apple.com/itunes-assets/AudioPreview115/v4/1d/92/e5/1d92e5a7-b5aa-2259-dd60-cf8c5f0df7d1/mzaf_6740927382698949605.plus.aac.p.m4a,https://is1-ssl.mzstatic.com/image/thumb/Music211/v4/b3/5e/0f/b35e0fbe-2370-fc48-0f0c-977525e93bf2/720841214601_Cover.jpg/600x600bb.jpg,https://music.apple.com/us/album/sweet/1217977525?i=1217977757&uo=4,itunes
swoon::the chemical brothers,False,Swoon The Chemical Brothers Further,,,,,,,itunes
s谩lvora::huma,False,S谩lvora Huma S谩lvora,,,,,,,itunes
s贸 basta voc锚 me ligar::z茅 vaqueiro,False,S贸 Basta Voc锚 Me Ligar Z茅 Vaqueiro O Original,,,,,,,itunes
t.i.b.w.f.::the budos band,False,T.I.B.W.F. The Budos Band The Budos Band,,,,,,,itunes
tabu::stam1na,False,Tabu Stam1na Novus Ordo Mundi,,,,,,,itunes
take a number::smartface king sis,False,Take A Number Smartface King Sis Take A Number,,,,,,,itunes
take california - short one::propellerheads,False,Take California - Short One Propellerheads Take California,,,,,,,itunes
take it easy - sonny fodera & mat.joe remix::gershon jackson mat.joe sonny fodera,False,Take It Easy - Sonny Fodera & Mat.Joe Remix Gershon Jackson Mat.Joe Sonny Fodera Take It Easy,,,,,,,itunes
take me back::sarah jarosz,False,Take Me Back Sarah Jarosz Undercurrent,,,,,,,itunes
take me home::us the duo,False,Take Me Home Us The Duo Us,,,,,,,itunes
take me out::franz ferdinand,True,Take Me Out Franz Ferdinand Franz Ferdinand,Take Me Out,Franz Ferdinand,Franz Ferdinand,https://audio-ssl.itunes.apple.com/itunes-assets/AudioPreview112/v4/39/0b/12/390b12af-41bf-8587-3bbf-d54ad7c69f63/mzaf_6391656788554881067.plus.aac.p.m4a,https://is1-ssl.mzstatic.com/image/thumb/Music112/v4/83/c6/54/83c6541f-3b90-b46a-b46a-17bf8fd9af16/5034202113645.png/600x600bb.jpg,https://music.apple.com/us/album/take-me-out/315843479?i=315844084&uo=4,itunes
talkatif::antibalas,False,Talkatif Antibalas Talkatif,,,,,,,itunes
tarde - remastered::julio sosa,False,Tarde - Remastered Julio Sosa Var贸n (Remastered),,,,,,,itunes
tauko::juhani ahonen,False,Tauko Juhani Ahonen Tauko,,,,,,,itunes
"te amar, te amar::iguinho e lulinha",False,"Te Amar, Te Amar Iguinho e Lulinha Simbora pra Vaquejada",,,,,,,itunes
te amei a mais - ao vivo::douglas & vinicius,False,Te Amei A Mais - Ao Vivo Douglas & Vinicius Ao Vivo Em S茫o Paulo (Vol. 4),,,,,,,itunes
tears of a dragonheart::bloodbound,False,Tears of a Dragonheart Bloodbound War of Dragons,,,,,,,itunes
tearz::el michels affair lee fields the shacks,False,Tearz El Michels Affair Lee Fields The Shacks Return To The 37th Chamber,,,,,,,itunes
telefone fora de 脕rea::banda magn铆ficos,False,Telefone Fora de 脕rea Banda Magn铆ficos Telefone Fora de 脕rea 2008,,,,,,,itunes
tempest of blades::battle beast,False,Tempest Of Blades Battle Beast Circus Of Doom,,,,,,,itunes
temple white::ludovico einaudi,True,Temple White Ludovico Einaudi Underwater,Temple White,Ludovico Einaudi,Underwater (Video Edition),https://audio-ssl.itunes.apple.com/itunes-assets/AudioPreview221/v4/81/16/ee/8116ee43-d635-8cdb-bbf9-65eb5a304ef1/mzaf_12003948578210369226.plus.aac.p.m4a,https://is1-ssl.mzstatic.com/image/thumb/Music125/v4/57/8f/7a/578f7a73-7f9c-4a27-eeef-918cc78d7fb2/21UMGIM81023.rgb.jpg/600x600bb.jpg,https://music.apple.com/us/album/temple-white/1589791548?i=1589791561&uo=4,itunes
temporality::savage bops,False,Temporality Savage Bops Temporality,,,,,,,itunes
tengo luquita::juanaf茅,False,Tengo Luquita Juanaf茅 La Makinita,,,,,,,itunes
termina comigo::vitor fernandes,False,Termina Comigo Vitor Fernandes Piseiro Apaixonado - Pt. 1,,,,,,,itunes
test & recognise - flume re-work::seekae flume,True,Test & Recognise - Flume Re-work Seekae Flume Test & Recognise (Remixes),Test & Recognise,Seekae,Test & Recognise (Remixes) - EP,https://audio-ssl.itunes.apple.com/itunes-assets/AudioPreview116/v4/ed/cf/2f/edcf2f1b-a2d1-869d-47f0-2cd688ffd22f/mzaf_6896794977551839329.plus.aac.p.m4a,https://is1-ssl.mzstatic.com/image/thumb/Music116/v4/69/28/cf/6928cf8e-da69-cea8-0a36-f9d6fb884449/3610156651529_Cover.jpg/600x600bb.jpg,https://music.apple.com/us/album/test-recognise/1709027757?i=1709027758&uo=4,itunes
teste de farm谩cia::unha pintada,False,Teste de Farm谩cia Unha Pintada Teste de Farm谩cia,,,,,,,itunes
teutonic terror::accept,False,Teutonic Terror Accept Blood of the Nations,,,,,,,itunes
tezeta (nostalgia)::mulatu astatke,False,"Tezeta (Nostalgia) Mulatu Astatke Ethiopiques, Vol. 4: Ethio Jazz 1969-1974",,,,,,,itunes
tezeta::mulatu astatke,False,Tezeta Mulatu Astatke New York - Addis - London: The Story of Ethio Jazz 1965-1975,,,,,,,itunes
thank you lord::calledout music,False,Thank You Lord CalledOut Music Thank You Lord,,,,,,,itunes
that's the way love is - underground mix edit::ten city,False,That's the Way Love Is - Underground Mix Edit Ten City Foundation,,,,,,,itunes
"the acid life - extended version::farley ""jackmaster"" funk",False,"The Acid Life - Extended Version Farley ""Jackmaster"" Funk Farley ""Jackmaster"" Funk",,,,,,,itunes
the adults are talking::the strokes,False,The Adults Are Talking The Strokes The New Abnormal,,,,,,,itunes
the band played on::glenn underground,False,"The Band Played On Glenn Underground July 12, 1979",,,,,,,itunes
the battle of new orleans::johnny horton,False,The Battle of New Orleans Johnny Horton,,,,,,,itunes
the beach::the neighbourhood,True,The Beach The Neighbourhood Wiped Out!,The Beach,The Neighbourhood,Wiped Out! (10th Anniversary Edition),https://audio-ssl.itunes.apple.com/itunes-assets/AudioPreview221/v4/0f/c2/cd/0fc2cdfa-ed83-2bde-67c0-db91e60f6e23/mzaf_6671680033704445709.plus.aac.p.m4a,https://is1-ssl.mzstatic.com/image/thumb/Music221/v4/ac/05/53/ac05530a-c992-0098-ea9f-4434779533d3/196873591407.jpg/600x600bb.jpg,https://music.apple.com/us/album/the-beach/1848275435?i=1848275442&uo=4,itunes
the best is yet to come::accept,False,The Best Is yet to Come Accept Too Mean to Die,,,,,,,itunes
the book of heavy metal (march of the metallians)::dream evil,False,The Book of Heavy Metal (March of the Metallians) Dream Evil The Book of Heavy Metal,,,,,,,itunes
the boxer feat. mumford & sons and paul simon::jerry douglas paul simon mumford & sons,False,The Boxer feat. Mumford & Sons and Paul Simon Jerry Douglas Paul Simon Mumford & Sons Traveler,,,,,,,itunes
the chipmunk song::the chipmunks,False,The Chipmunk Song The Chipmunks,,,,,,,itunes
the chosen ones::dream evil,False,The Chosen Ones Dream Evil Dragonslayer,,,,,,,itunes
the darkness that you fear::the chemical brothers,False,The Darkness That You Fear The Chemical Brothers The Darkness That You Fear,,,,,,,itunes
the deadite girls gone wild::lordi,False,The Deadite Girls Gone Wild Lordi The Arockalypse,,,,,,,itunes
the departure::max richter lang lang,True,The Departure Max Richter Lang Lang Voyager - Essential Max Richter,The Departure,Lang Lang,Voyager - Essential Max Richter,https://audio-ssl.itunes.apple.com/itunes-assets/AudioPreview211/v4/93/34/e1/9334e139-2d6b-1440-6cbe-d0892e649503/mzaf_10011005209932161255.plus.aac.p.m4a,https://is1-ssl.mzstatic.com/image/thumb/Music125/v4/43/02/74/43027407-3cbd-a3ec-09e5-ce9f5c202244/19UMGIM64276.rgb.jpg/600x600bb.jpg,https://music.apple.com/us/album/the-departure/1480784968?i=1480785340&uo=4,itunes
the golden path::the chemical brothers the flaming lips,False,The Golden Path The Chemical Brothers The Flaming Lips Brotherhood,,,,,,,itunes
the goose steps high::george bruns,False,The Goose Steps High George Bruns Walt Disney Records The Legacy Collection: The Aristocats,,,,,,,itunes
the gospel truth i / main titles - hercules::cheryl freeman lachanze vaneese thomas lillias white roz ryan disney,False,The Gospel Truth I / Main Titles - Hercules Cheryl Freeman LaChanze Vaneese Thomas Lillias White Roz Ryan Disney Hercules (Original Motion Picture Soundtrack),,,,,,,itunes
"the happy organ::dave ""baby"" cortez",False,"The Happy Organ Dave ""Baby"" Cortez",,,,,,,itunes
the kids aren't alright::the offspring,False,The Kids Aren't Alright The Offspring Americana,,,,,,,itunes
the lion sleeps tonight::billy eichner seth rogen,False,The Lion Sleeps Tonight Billy Eichner Seth Rogen The Lion King (Original Motion Picture Soundtrack),,,,,,,itunes
the mad tea party / the unbirthday song / twinkle twinkle / clean cup move down / mad watch::kathryn beaumont edwynn james macdonald jerry colonna,False,The Mad Tea Party / The Unbirthday Song / Twinkle Twinkle / Clean Cup Move Down / Mad Watch Kathryn Beaumont Edwynn James Macdonald Jerry Colonna Alice In Wonderland (Original Motion Picture Soundtrack),,,,,,,itunes
the man who sold the world::nirvana,True,The Man Who Sold The World Nirvana MTV Unplugged In New York,The Man Who Sold the World (Live Acoustic),Nirvana,MTV Unplugged In New York (Live Acoustic),https://audio-ssl.itunes.apple.com/itunes-assets/AudioPreview125/v4/e5/27/7a/e5277ad5-2777-e074-04c8-9ebc8d61297c/mzaf_1834049229068555483.plus.aac.p.m4a,https://is1-ssl.mzstatic.com/image/thumb/Music125/v4/46/24/33/462433f9-ee74-2d60-4538-859826a7bed7/00720642472729.rgb.jpg/600x600bb.jpg,https://music.apple.com/us/album/the-man-who-sold-the-world-live-acoustic/1440892370?i=1440892680&uo=4,itunes
the middle::jimmy eat world,False,The Middle Jimmy Eat World Bleed American,,,,,,,itunes
the next right thing::kristen bell,False,The Next Right Thing Kristen Bell Frozen 2 (Original Motion Picture Soundtrack/Deluxe Edition),,,,,,,itunes
the other side::rosetta arroyo,False,The Other Side Rosetta Arroyo The Other Side,,,,,,,itunes
the other son of odin::brothers of metal,False,The Other Son of Odin Brothers of Metal The Other Son of Odin,,,,,,,itunes
the outsider::lack of afro,False,The Outsider Lack Of Afro Press On,,,,,,,itunes
the pretender::foo fighters,True,"The Pretender Foo Fighters Echoes, Silence, Patience & Grace",The Pretender,Foo Fighters,"Echoes, Silence, Patience & Grace",https://audio-ssl.itunes.apple.com/itunes-assets/AudioPreview221/v4/5f/41/f8/5f41f86a-1d7a-0c1e-7b29-55cd5fa40c4c/mzaf_1876575708645472937.plus.aac.p.m4a,https://is1-ssl.mzstatic.com/image/thumb/Music211/v4/1a/a8/d2/1aa8d22d-f1ab-0462-e6f0-4f19b2594383/886971151626.jpg/600x600bb.jpg,https://music.apple.com/us/album/the-pretender/262743410?i=262743414&uo=4,itunes
the reason::hoobastank,False,The Reason Hoobastank The Reason (15th Anniversary Deluxe),,,,,,,itunes
the riddle of dreams::carligo,False,The Riddle of Dreams Carligo The Riddle of Dreams,,,,,,,itunes
the salmon dance::the chemical brothers,False,The Salmon Dance The Chemical Brothers We Are The Night,,,,,,,itunes
the sound of music::charmian carr heather menzies nicholas hammond duane chase angela cartwright debbie turner kym karath bill lee,False,The Sound Of Music Charmian Carr Heather Menzies Nicholas Hammond Duane Chase Angela Cartwright Debbie Turner Kym Karath Bill Lee The Sound Of Music (Original Soundtrack Recording),,,,,,,itunes
the story::brandi carlile,True,The Story Brandi Carlile The Story,The Story,Brandi Carlile,The Story,https://audio-ssl.itunes.apple.com/itunes-assets/AudioPreview115/v4/2d/10/cd/2d10cd55-8d25-4894-2dd9-547f879c641b/mzaf_10372144637331825749.plus.aac.p.m4a,https://is1-ssl.mzstatic.com/image/thumb/Music/7f/d1/31/mzi.nmwgtsqv.jpg/600x600bb.jpg,https://music.apple.com/us/album/the-story/250112717?i=250112772&uo=4,itunes
the sun can't compare - long version::larry heard mr white,False,The Sun Can't Compare - Long Version Larry Heard Mr White E.P.,,,,,,,itunes
the theory of everything::j贸hann j贸hannsson,False,The Theory of Everything J贸hann J贸hannsson The Theory of Everything (Original Motion Picture Soundtrack),,,,,,,itunes
the three bells (les trois cloches)::the browns,False,The Three Bells (Les Trois Cloches) The Browns,,,,,,,itunes
the traitor::menahan street band,False,The Traitor Menahan Street Band Make the Road By Walking,,,,,,,itunes
the weakness in me::keisha white,False,The Weakness in Me Keisha White The Weakness In Me,,,,,,,itunes
the whistle song::frankie knuckles,False,The Whistle Song Frankie Knuckles Beyond The Mix,,,,,,,itunes
the wilhelm scream::the bamboos washington,False,The Wilhelm Scream The Bamboos Washington Medicine Man,,,,,,,itunes
theme from a summer place::percy faith & his orchestra,False,Theme from A Summer Place Percy Faith & His Orchestra,,,,,,,itunes
there's a new day coming::menahan street band saundra williams,False,There's a New Day Coming Menahan Street Band Saundra Williams There's a New Day Coming / Tommy Don't,,,,,,,itunes
this fffire - new version::franz ferdinand,True,This fffire - New Version Franz Ferdinand This fffire,This Fffire,Franz Ferdinand,This Fffire - Single,https://audio-ssl.itunes.apple.com/itunes-assets/AudioPreview115/v4/b8/50/f2/b850f2d6-baa3-37da-d6b4-19783205e232/mzaf_14666607249903409475.plus.aac.p.m4a,https://is1-ssl.mzstatic.com/image/thumb/Features/e1/a5/ea/dj.plgyurpa.jpg/600x600bb.jpg,https://music.apple.com/us/album/this-fffire/29276051?i=29276049&uo=4,itunes
time to jack - vocal mix::chip e.,False,Time To Jack - Vocal Mix Chip E. Time To Jack,,,,,,,itunes
timidez - ao vivo::cavalo de pau,False,"Timidez - Ao Vivo Cavalo De Pau Forr贸 Cavalo de Pau, Vol. I (Ao Vivo)",,,,,,,itunes
tiniebla::pearl melendez,False,Tiniebla Pearl Melendez Tiniebla,,,,,,,itunes
tippa my tongue::red hot chili peppers,True,Tippa My Tongue Red Hot Chili Peppers Rock Brandneu,Tippa My Tongue,Red Hot Chili Peppers,Rock Brandneu,https://audio-ssl.itunes.apple.com/itunes-assets/AudioPreview122/v4/b8/e0/1e/b8e01e0b-6274-c487-c1a2-4198983be5ba/mzaf_4599244938480560795.plus.aac.p.m4a,https://is1-ssl.mzstatic.com/image/thumb/Music112/v4/27/ea/76/27ea764e-c3b4-8e00-c5bc-90df25579137/5059460156913.jpg/600x600bb.jpg,https://music.apple.com/us/album/tippa-my-tongue/1645312116?i=1645312616&uo=4,itunes
tirana wolves::wolves club,False,Tirana Wolves Wolves Club On the Davenport,,,,,,,itunes
to get down - radio mix::timo maas,False,To Get Down - Radio Mix Timo Maas Loud (Eastwest Release),,,,,,,itunes
to know him is to love him::the teddy bears,False,To Know Him is to Love Him The Teddy Bears,,,,,,,itunes
"todo es en vano, si no hay amor - en vivo::almafuerte",False,"Todo Es en Vano, Si No Hay Amor - En Vivo Almafuerte En Vivo Obras",,,,,,,itunes
todo se transforma::jorge drexler,False,Todo se transforma Jorge Drexler Eco,,,,,,,itunes
tokyo trainspotting::nathan kawanishi,False,Tokyo Trainspotting Nathan Kawanishi Nostalgia,,,,,,,itunes
tom dooley::the kingston trio,False,Tom Dooley The Kingston Trio,,,,,,,itunes
tomo y obligo::carlos gardel,False,Tomo Y Obligo Carlos Gardel El Album De Oro De Carlos Gardel,,,,,,,itunes
tomo y obligo::carlos lombardi los rom芒nticos de la noche,False,Tomo y Obligo Carlos Lombardi Los Rom芒nticos De La Noche Lo Mejor Del Tango,,,,,,,itunes
tongue tied::grouplove,False,Tongue Tied Grouplove Never Trust a Happy Song,,,,,,,itunes
too mean to die::accept,False,Too Mean to Die Accept Too Mean to Die,,,,,,,itunes
tortilla monday::breakfast for brunch,False,Tortilla Monday Breakfast For Brunch Tortilla Monday,,,,,,,itunes
tossin' and turnin'::bobby lewis,False,Tossin' and Turnin' Bobby Lewis,,,,,,,itunes
tou embrasado::josu茅 bom de faixa,False,Tou Embrasado Josu茅 Bom de Faixa O Bom de Faixa,,,,,,,itunes
touch::cigarettes after sex,True,Touch Cigarettes After Sex Cry,Touch,Cigarettes After Sex,Cry,https://audio-ssl.itunes.apple.com/itunes-assets/AudioPreview211/v4/cf/ff/27/cfff276d-3a70-14b3-8895-45acaaa6f680/mzaf_5830283521846167459.plus.aac.p.m4a,https://is1-ssl.mzstatic.com/image/thumb/Music113/v4/a2/1e/b4/a21eb48e-05ac-ace3-00f5-c1cb53e74e58/720841217305_Cover.jpg/600x600bb.jpg,https://music.apple.com/us/album/touch/1476598231?i=1476598236&uo=4,itunes
touch::sleeping at last,True,Touch Sleeping At Last Atlas: II,Touch,Sleeping At Last,Atlas: II,https://audio-ssl.itunes.apple.com/itunes-assets/AudioPreview125/v4/81/75/8f/81758f5f-43ae-2f5d-cad5-8fa5ba8eb6d0/mzaf_1909652100081173931.plus.aac.p.m4a,https://is1-ssl.mzstatic.com/image/thumb/Music125/v4/f5/3e/16/f53e1668-fd10-1449-039e-5beef4b937ed/859735241048_cover.jpg/600x600bb.jpg,https://music.apple.com/us/album/touch/1484386235?i=1484386904&uo=4,itunes
tremidinha - ao vivo::biu do piseiro,False,Tremidinha - Ao Vivo Biu do Piseiro Biu do Piseiro - At茅 o Talo (Ao Vivo),,,,,,,itunes
triunfo - live::criolo emicida,False,Triunfo - Live Criolo Emicida Criolo E Emicida Ao Vivo (Live),,,,,,,itunes
trust - motor city drum ensemble deep mix::romanthony motor city drum ensemble,False,Trust - Motor City Drum Ensemble Deep Mix Romanthony Motor City Drum Ensemble Trust 2014,,,,,,,itunes
trust me::roni size,False,Trust Me Roni Size New Forms,,,,,,,itunes
turn up the bass - fast eddie scratch it up mix::tyree cooper,False,Turn Up The Bass - Fast Eddie Scratch It Up Mix Tyree Cooper Turn Up The Bass,,,,,,,itunes
turndown service::adeline verver,False,Turndown Service Adeline Verver Turndown Service,,,,,,,itunes
turning page::sleeping at last,True,Turning Page Sleeping At Last Turning Page,Turning Page,Sleeping At Last,Turning Page - Single,https://audio-ssl.itunes.apple.com/itunes-assets/AudioPreview211/v4/f6/23/59/f623591e-441a-f300-1642-12f935789385/mzaf_3423939552028988004.plus.aac.p.m4a,https://is1-ssl.mzstatic.com/image/thumb/Music211/v4/76/93/8a/76938a31-d076-c0cf-872e-c32fa9047643/859746947847_cover.jpg/600x600bb.jpg,https://music.apple.com/us/album/turning-page/1561983266?i=1561983646&uo=4,itunes
two sugars::zil baii,False,Two Sugars Zil Baii Two Sugars,,,,,,,itunes
t煤 eres su seguridad::hermetica,False,T煤 Eres Su Seguridad Hermetica Int茅rpretes,,,,,,,itunes
um sonho de amor::lim茫o com mel wesley safad茫o,False,Um Sonho de Amor Lim茫o Com Mel Wesley Safad茫o Est煤dio Lim茫o,,,,,,,itunes
un poco loco::luis 脕ngel g贸mez jaramillo gael garcia bernal,False,Un Poco Loco Luis 脕ngel G贸mez Jaramillo Gael Garcia Bernal Coco (Banda Sonora Original en Espa帽ol),,,,,,,itunes
un vestido y un amor::adriana varela walter r铆os esteban morgado litto nebbia,False,Un Vestido y un Amor Adriana Varela Walter R铆os Esteban Morgado Litto Nebbia Maquillaje,,,,,,,itunes
una mattina::ludovico einaudi,True,Una Mattina Ludovico Einaudi Una Mattina,Una Mattina,Ludovico Einaudi,Una Mattina,https://audio-ssl.itunes.apple.com/itunes-assets/AudioPreview221/v4/3f/64/30/3f64303f-dbda-23e4-6b23-64e8df7eb5e7/mzaf_12817939629152130724.plus.aac.p.m4a,https://is1-ssl.mzstatic.com/image/thumb/Music125/v4/ea/44/86/ea448600-257f-670f-7f06-332e02b42abc/06UMGIM59381.rgb.jpg/600x600bb.jpg,https://music.apple.com/us/album/una-mattina/1440762051?i=1440762058&uo=4,itunes
uncommon ritual - instrumental::mike marshall edgar meyer b茅la fleck,False,Uncommon Ritual - Instrumental Mike Marshall Edgar Meyer B茅la Fleck Uncommon Ritual,,,,,,,itunes
unconditional::andy tallent,False,Unconditional Andy Tallent Unconditional,,,,,,,itunes
under samma himmel::sanja g枚ransson,False,Under Samma Himmel Sanja G枚ransson Under Samma Himmel,,,,,,,itunes
under the bridge::red hot chili peppers,False,Under the Bridge Red Hot Chili Peppers Blood Sugar Sex Magik (Deluxe Edition),,,,,,,itunes
"under the sea - from ""the little mermaid"" / soundtrack version::samuel e. wright disney",False,"Under the Sea - From ""The Little Mermaid"" / Soundtrack Version Samuel E. Wright Disney The Little Mermaid",,,,,,,itunes
under the sea::samuel e. wright disney,False,Under the Sea Samuel E. Wright Disney The Little Mermaid Special Edition,,,,,,,itunes
undercover::bassnectar,False,Undercover Bassnectar Reflective (Part 4),,,,,,,itunes
union dixie::tennessee ernie ford,False,Union Dixie Tennessee Ernie Ford Songs Of The Civil War,,,,,,,itunes
uno (with armando pontier y su orquesta)::julio sosa armando pontier y su orquesta,False,Uno (with Armando Pontier y su Orquesta) Julio Sosa Armando Pontier y su Orquesta 30 Aniversario 1964/1994,,,,,,,itunes
up the ladder::town mountain,False,Up the Ladder Town Mountain Leave the Bottle,,,,,,,itunes
vacuum with pure brown noise - loopable with no fade::sleep baby sleep vacuum cleaner white noise lullaby land background appliances white noise appliances,False,"Vacuum with Pure Brown Noise - Loopable with no fade Sleep Baby Sleep Vacuum Cleaner White Noise Lullaby Land Background Appliances White Noise Appliances Vacuums, Dryers and Washing Machines (Loopable Audio for Insomnia, Meditation, and Restless Children)",,,,,,,itunes
velocity shift::overseer,False,Velocity Shift Overseer Wreckage,,,,,,,itunes
venga mi vida::juanaf茅,False,Venga Mi Vida Juanaf茅 La Makinita,,,,,,,itunes
venus::frankie avalon,False,Venus Frankie Avalon,,,,,,,itunes
verdadeiro amor - ao vivo::banda magn铆ficos,False,Verdadeiro Amor - Ao Vivo Banda Magn铆ficos Ao Vivo,,,,,,,itunes
vida loka i - live::criolo emicida mano brown,False,Vida Loka I - Live Criolo Emicida Mano Brown Criolo E Emicida Ao Vivo (Live),,,,,,,itunes
viento estelar::universo,False,Viento Estelar Universo Galaxia,,,,,,,itunes
views from yamashita park::nathan kawanishi,False,Views from Yamashita Park Nathan Kawanishi Nostalgia,,,,,,,itunes
villa::el michels affair,False,Villa El Michels Affair Adult Themes,,,,,,,itunes
vivendo de solid茫o::lim茫o com mel nattan,False,Vivendo de Solid茫o Lim茫o Com Mel NATTAN Vivendo de Solid茫o,,,,,,,itunes
volte amor::tayrone cigano,False,Volte Amor Tayrone Cigano 20 Super Sucessos: Tayrone Cigano,,,,,,,itunes
volvi贸 una noche::carlos gardel,False,Volvi贸 Una Noche Carlos Gardel El Album De Oro De Carlos Gardel,,,,,,,itunes
voodoo people - pendulum mix::the prodigy pendulum,False,Voodoo People - Pendulum Mix The Prodigy Pendulum Their Law The Singles 1990 - 2005,,,,,,,itunes
voodoo people::the prodigy,False,Voodoo People The Prodigy Music for the Jilted Generation,,,,,,,itunes
