cache_key,found,query,track_name,artist_name,collection_name,preview_url,artwork_url,track_view_url,source
make the road by walking::menahan street band,False,Make the Road By Walking Menahan Street Band Make the Road By Walking,,,,,,,itunes
making all things new::aaron espe,True,Making All Things New Aaron Espe Making All Things New,Making All Things New,Aaron Espe,Making All Things New - Single,https://audio-ssl.itunes.apple.com/itunes-assets/AudioPreview116/v4/98/11/8e/98118e24-4a89-3026-f385-46626cdf7ec0/mzaf_18155515291257052270.plus.aac.p.m4a,https://is1-ssl.mzstatic.com/image/thumb/Music211/v4/f2/c8/41/f2c84193-7bac-0c9a-c95d-4a1e2457d47c/067003434355.png/600x600bb.jpg,https://music.apple.com/us/album/making-all-things-new/1611911897?i=1611911900&uo=4,itunes
mala noche::riff,False,Mala Noche Riff Que Sea Rock,,,,,,,itunes
malena (with orquesta tipica porte帽a)::roberto goyeneche orquesta tipica porte帽a,False,Malena (with Orquesta Tipica Porte帽a) Roberto Goyeneche Orquesta Tipica Porte帽a Antologia Roberto Goyeneche,,,,,,,itunes
malevaje (with ra煤l garello y su orquesta)::roberto goyeneche ra煤l garello y su orquesta,False,Malevaje (with Ra煤l Garello y su Orquesta) Roberto Goyeneche Ra煤l Garello y su Orquesta Antologia Roberto Goyeneche,,,,,,,itunes
malevaje::edmundo rivero,False,Malevaje Edmundo Rivero Edmundo Rivero: Edmundo Rivero Canta A Discepolo / Tangos Que Hicieron 脡poca,,,,,,,itunes
malevaje::susana rinaldi,False,Malevaje Susana Rinaldi La Tana Con Todo,,,,,,,itunes
mam t臋 moc - z filmu 鈥濳raina lodu鈥?::katarzyna 艁aska,False,Mam T臋 Moc - z filmu 鈥濳raina lodu鈥? Katarzyna 艁aska Disney Najwieksze Przeboje (4 Vol.),,,,,,,itunes
mama says no::the steeldrivers,False,Mama Says No The Steeldrivers Bad For You,,,,,,,itunes
manchete dos jornais::calcinha preta,False,"Manchete dos Jornais Calcinha Preta M谩gica, Vol. 12",,,,,,,itunes
manhattan::eric johnson,False,Manhattan Eric Johnson Venus Isle,,,,,,,itunes
marcha peronista::hugo del carril,False,Marcha Peronista Hugo Del Carril Marcha Peronista - Evita Capitana,,,,,,,itunes
margot::julio sosa orquesta de leopoldo federico,False,Margot Julio Sosa Orquesta de Leopoldo Federico 20 Great Tangos,,,,,,,itunes
mariposita - en vivo::ariel ardit orquesta tipica,False,Mariposita - En Vivo Ariel Ardit Orquesta Tipica A los Cantores (En Vivo),,,,,,,itunes
master of illusion::battle beast,False,Master of Illusion Battle Beast Circus Of Doom,,,,,,,itunes
maybe::flower face,True,Maybe Flower Face The Shark in Your Water,Maybe,Flower Face,The Shark in Your Water,https://audio-ssl.itunes.apple.com/itunes-assets/AudioPreview211/v4/e5/4a/ff/e54affda-8581-9e3d-c09b-c563975c11c8/mzaf_15552002489271773180.plus.aac.p.m4a,https://is1-ssl.mzstatic.com/image/thumb/Music211/v4/74/cd/0e/74cd0e81-81c4-293e-d696-19e1dce9a562/067003133852.png/600x600bb.jpg,https://music.apple.com/us/album/maybe/1620083091?i=1620083218&uo=4,itunes
me corte na boca do c茅u a morte n茫o pede perd茫o::criolo milton nascimento,False,Me Corte na Boca do C茅u a Morte N茫o Pede Perd茫o Criolo Milton Nascimento Sobre Viver,,,,,,,itunes
me usa::banda magn铆ficos,False,Me Usa Banda Magn铆ficos Fonte dos Desejos,,,,,,,itunes
meet la familia::germaine franco,False,Meet La Familia Germaine Franco Encanto (Original Motion Picture Soundtrack),,,,,,,itunes
mellow::boreal embla,False,Mellow Boreal Embla Mellow,,,,,,,itunes
memoria de siglos::hermetica,False,Memoria de Siglos Hermetica Acido Argentino,,,,,,,itunes
menino mimado::criolo,False,Menino Mimado Criolo Espiral de Ilus茫o,,,,,,,itunes
metal heart::accept,False,Metal Heart Accept Metal Heart,,,,,,,itunes
mexeu comigo::iguinho e lulinha,False,Mexeu Comigo Iguinho e Lulinha Simbora pra Vaquejada,,,,,,,itunes
mi buenos aires querido (with osvaldo berlingieri y su orquesta)::roberto goyeneche osvaldo berlingieri y su orquesta,False,Mi Buenos Aires Querido (with Osvaldo Berlingieri Y Su Orquesta) Roberto Goyeneche Osvaldo Berlingieri y su Orquesta Inolvidables RCA - 20 Grandes Exitos - Volumen 2,,,,,,,itunes
mi dolor::h茅ctor maur茅,False,Mi Dolor H茅ctor Maur茅 Antolog铆a Noble Del Tango: Sus Grandes Int茅rpretes Y Compositores,,,,,,,itunes
mi noche triste::julio sosa,False,Mi Noche Triste Julio Sosa Cantor de Pueblo: Julio Sosa,,,,,,,itunes
michael - love from san francisco dub::roy davis jr.,False,Michael - Love From San Francisco Dub Roy Davis Jr. Michael,,,,,,,itunes
milonga sentimental::carlos gardel,False,"Milonga Sentimental Carlos Gardel Mano a Mano, 1927",,,,,,,itunes
mind that gap::bentley rhythm ace,False,Mind That Gap Bentley Rhythm Ace BRA,,,,,,,itunes
mindfields::the prodigy,False,Mindfields The Prodigy The Fat of the Land,,,,,,,itunes
min盲 tuun nelostiet盲::jaska m盲kynen,False,Min盲 tuun nelostiet盲 Jaska M盲kynen Espanjan Y枚t,,,,,,,itunes
mirrors::tairata,False,Mirrors Tairata Mirrors,,,,,,,itunes
missing you::alison krauss john waite,False,Missing You Alison Krauss John Waite A Hundred Miles Or More: A Collection,,,,,,,itunes
missing you::larry heard,False,Missing You Larry Heard Charles Webster - Coast2Coast,,,,,,,itunes
mo chroidhe::mila harper,False,Mo Chroidhe Mila Harper Mo Chroidhe,,,,,,,itunes
monster::skillet,True,Monster Skillet Awake,Monster,Skillet,Awake,https://audio-ssl.itunes.apple.com/itunes-assets/AudioPreview221/v4/99/8a/aa/998aaa86-8306-f71f-ab1d-b8951846550b/mzaf_15302011303065983173.plus.aac.p.m4a,https://is1-ssl.mzstatic.com/image/thumb/Music124/v4/3a/e3/a7/3ae3a7a7-81aa-f976-c3b4-2850f83f5193/075679951038.jpg/600x600bb.jpg,https://music.apple.com/us/album/monster/668404134?i=668404139&uo=4,itunes
"monsters, inc.::randy newman",False,"Monsters, Inc. Randy Newman Monsters, Inc. (Original Motion Picture Soundtrack)",,,,,,,itunes
moog me up::wibke komi,False,moog me up Wibke Komi moog me up,,,,,,,itunes
moonlight rendezvous::beast in black,False,Moonlight Rendezvous Beast In Black Dark Connection,,,,,,,itunes
more mess on my thing::the poets of rhythm,False,More Mess on My Thing The Poets Of Rhythm Practice What You Preach,,,,,,,itunes
morning stretch::timothy infinite,False,Morning Stretch Timothy Infinite As The Sun Rises,,,,,,,itunes
morning::sarah jarosz,False,Morning Sarah Jarosz Blue Heron Suite,,,,,,,itunes
"mother knows best (reprise) - from ""tangled""/soundtrack version::donna murphy",False,"Mother Knows Best (Reprise) - From ""Tangled""/Soundtrack Version Donna Murphy Tangled",,,,,,,itunes
"mother knows best - from ""tangled""/soundtrack version::donna murphy",False,"Mother Knows Best - From ""Tangled""/Soundtrack Version Donna Murphy Tangled",,,,,,,itunes
mountain::kitchen dwellers,False,Mountain Kitchen Dwellers Ghost in the Bottle,,,,,,,itunes
move on up::the dynamics,False,Move on Up The Dynamics Version Excursions,,,,,,,itunes
move your body::marshall jefferson,False,Move Your Body Marshall Jefferson Frankie Knuckles Presents: His Greatest Hits from Trax Records,,,,,,,itunes
move your body::marshall jefferson solardo,False,Move Your Body Marshall Jefferson Solardo Move Your Body,,,,,,,itunes
mr. blue::the fleetwoods,False,Mr. Blue The Fleetwoods,,,,,,,itunes
mr. brightside::the killers,False,Mr. Brightside The Killers Hot Fuss,,,,,,,itunes
muerte del angel::astor piazzolla fernando su谩rez paz pablo ziegler oscar l贸pez ruiz h茅ctor console,False,Muerte del Angel Astor Piazzolla Fernando Su谩rez Paz Pablo Ziegler Oscar L贸pez Ruiz H茅ctor Console Libertango,,,,,,,itunes
muerte en hawaii::calle 13,False,Muerte En Hawaii Calle 13 Entren Los Que Quieran,,,,,,,itunes
mujer amante::rata blanca,False,"Mujer Amante Rata Blanca Col 2x1: Magos, Espadas Y Rosas / Guerrero Del Arco Iris",,,,,,,itunes
mushrooms - salt city orchestra out there mix::marshall jefferson noosa heads salt city orchestra,False,Mushrooms - Salt City Orchestra Out There Mix Marshall Jefferson Noosa Heads Salt City Orchestra Mushrooms,,,,,,,itunes
music's in me - original mix::paul johnson,False,Music's In Me - Original Mix Paul Johnson Classics & Remixes,,,,,,,itunes
mu帽eca brava::alberto castillo,False,Mu帽eca brava Alberto Castillo Alberto Castillo - Asi se baila el tango,,,,,,,itunes
mystery of love - mixed::mr. fingers,False,Mystery of Love - Mixed Mr. Fingers DJ-Kicks (Motor City Drum Ensemble) [DJ Mix],,,,,,,itunes
mystery of love::mr. fingers,False,Mystery of Love Mr. Fingers Amnesia,,,,,,,itunes
"mystical - alpha sinus 54,8hz - 57,3 hz::drone",False,"Mystical - Alpha Sinus 54,8hz - 57,3 hz Drone Healing Alpha Sinus",,,,,,,itunes
nada::julio sosa,False,Nada Julio Sosa Grandes 脡xitos De,,,,,,,itunes
name of the game::the crystal method,False,Name Of The Game The Crystal Method Tweekend,,,,,,,itunes
nangangamba::zack tabudlo,True,Nangangamba Zack Tabudlo Nangangamba,Nangangamba,Zack Tabudlo,Nangangamba - Single,https://audio-ssl.itunes.apple.com/itunes-assets/AudioPreview125/v4/6c/ab/94/6cab947c-e9da-4d58-3f73-06d7111a09b3/mzaf_18063611873664955177.plus.aac.p.m4a,https://is1-ssl.mzstatic.com/image/thumb/Music115/v4/9e/b5/ee/9eb5ee8f-8de2-b2af-43cc-127eed2042fe/20UMGIM60605.rgb.jpg/600x600bb.jpg,https://music.apple.com/us/album/nangangamba/1524596078?i=1524596079&uo=4,itunes
naranjo en flor (en directo)::roberto goyeneche,False,Naranjo en Flor (En Directo) Roberto Goyeneche Historia de Oro,,,,,,,itunes
narayan::the prodigy,False,Narayan The Prodigy The Fat of the Land,,,,,,,itunes
nasty::datsik virtual riot,False,Nasty Datsik Virtual Riot Sensei,,,,,,,itunes
naturesounds: surrounding gentle waves on a sandy shore for sleep disorder / apnea::natural white noise relaxation,False,Naturesounds: Surrounding Gentle Waves On a Sandy Shore for Sleep Disorder / Apnea Natural White Noise Relaxation Baby Sleep White Noise: Ultimate Album to Help Babies Sleep Through the Night,,,,,,,itunes
neblinoso::cameron sinosa,False,Neblinoso Cameron Sinosa Neblinoso,,,,,,,itunes
necesito tu amor::fidel nadal,True,Necesito Tu Amor Fidel Nadal Emocionado,Necesito Tu Amor,Fidel,Emocionado,https://audio-ssl.itunes.apple.com/itunes-assets/AudioPreview115/v4/68/e8/77/68e877a2-9221-8e1b-c636-56d6d013f341/mzaf_3971027633541722135.plus.aac.p.m4a,https://is1-ssl.mzstatic.com/image/thumb/Music4/v4/e5/ef/9f/e5ef9f61-2c86-aebf-8525-1987652c2e49/dj.uplhvgmm.jpg/600x600bb.jpg,https://music.apple.com/us/album/necesito-tu-amor/266448914?i=266450928&uo=4,itunes
nel blu dipinto di blu::domenico modugno,False,Nel Blu Dipinto Di Blu Domenico Modugno,,,,,,,itunes
nem uma semana::z茅 cantor ra铆 saia rodada,False,Nem uma Semana Z茅 Cantor Ra铆 Saia Rodada Nem uma Semana,,,,,,,itunes
nem voc锚 nem eu::vitor fernandes nattan,False,Nem Voc锚 Nem Eu Vitor Fernandes NATTAN Nem Voc锚 Nem Eu,,,,,,,itunes
neomatter::o k o,False,neomatter O k O neomatter,,,,,,,itunes
neon moon::cigarettes after sex,True,Neon Moon Cigarettes After Sex Neon Moon,Neon Moon,Cigarettes After Sex,Neon Moon - Single,https://audio-ssl.itunes.apple.com/itunes-assets/AudioPreview118/v4/59/7f/06/597f0627-07e8-4f79-eef8-5cab71080978/mzaf_7371667810580799460.plus.aac.p.m4a,https://is1-ssl.mzstatic.com/image/thumb/Music211/v4/d9/35/c3/d935c3b8-4155-a4ec-fdbc-df8fe22e1d5d/655003842371_Cover.jpg/600x600bb.jpg,https://music.apple.com/us/album/neon-moon/1446118011?i=1446118012&uo=4,itunes
neon tapestries::dusty decks,False,Neon Tapestries Dusty Decks Neon Tapestries,,,,,,,itunes
never tear us apart::bishop briggs,True,Never Tear Us Apart Bishop Briggs Fifty Shades Freed (Original Motion Picture Soundtrack),Never Tear Us Apart,Bishop Briggs,Fifty Shades Freed (Original Motion Picture Soundtrack),https://audio-ssl.itunes.apple.com/itunes-assets/AudioPreview221/v4/8c/ba/47/8cba47e6-aa0a-d616-0a2e-dc9d62291d23/mzaf_13643483325604439618.plus.aac.p.m4a,https://is1-ssl.mzstatic.com/image/thumb/Music112/v4/05/dc/ce/05dccee2-ed7e-8ffc-2038-439987e32c49/18UMGIM01206.rgb.jpg/600x600bb.jpg,https://music.apple.com/us/album/never-tear-us-apart/1440899253?i=1440899779&uo=4,itunes
never::orbital,False,Never Orbital Wonky,,,,,,,itunes
new star::watchhouse,False,New Star Watchhouse New Star,,,,,,,itunes
niebla del riachuelo::adriana varela,False,Niebla del Riachuelo Adriana Varela Docke,,,,,,,itunes
night blue skies::midnight smoothie,False,Night Blue Skies Midnight Smoothie Night Blue Skies,,,,,,,itunes
night on the river::the infamous stringdusters,False,Night on the River The Infamous Stringdusters Silver Sky,,,,,,,itunes
night singing::sara watkins,False,Night Singing Sara Watkins Under the Pepper Tree,,,,,,,itunes
nikad ne zaboravi::nadia bulic,False,Nikad ne Zaboravi Nadia Bulic Nikad ne Zaboravi,,,,,,,itunes
no good (start the dance)::the prodigy,False,No Good (Start the Dance) The Prodigy Music for the Jilted Generation,,,,,,,itunes
no hard feelings::the avett brothers,False,No Hard Feelings The Avett Brothers True Sadness,,,,,,,itunes
no matter where you are - wedding version::us the duo,False,No Matter Where You Are - Wedding Version Us The Duo Up Until Now,,,,,,,itunes
no surprises::radiohead,False,No Surprises Radiohead OK Computer,,,,,,,itunes
no surrender::beast in black,False,No Surrender Beast In Black From Hell with Love,,,,,,,itunes
nomalizo::letta mbulu,False,Nomalizo Letta Mbulu In The Music The Village Never Ends,,,,,,,itunes
nothing stops detroit::robert hood,False,Nothing Stops Detroit Robert Hood Mirror Man,,,,,,,itunes
nothing's gonna hurt you baby::cigarettes after sex,True,Nothing's Gonna Hurt You Baby Cigarettes After Sex EP I.,Nothing's Gonna Hurt You Baby,Cigarettes After Sex,I. - EP,https://audio-ssl.itunes.apple.com/itunes-assets/AudioPreview118/v4/8d/68/e1/8d68e182-3035-a97b-2700-b5848a98b8df/mzaf_4874034136926257718.plus.aac.p.m4a,https://is1-ssl.mzstatic.com/image/thumb/Music211/v4/9a/eb/1c/9aeb1c86-7dd7-b31e-9a40-e26a1ae38d89/720841228202_Cover.jpg/600x600bb.jpg,https://music.apple.com/us/album/nothings-gonna-hurt-you-baby/1266067531?i=1266067536&uo=4,itunes
nox::wolfgang snow,False,Nox Wolfgang Snow Nox,,,,,,,itunes
nunca foi amor::z茅 vaqueiro,False,Nunca Foi Amor Z茅 Vaqueiro Nunca Foi Amor,,,,,,,itunes
nuvole bianche::ludovico einaudi,True,Nuvole Bianche Ludovico Einaudi Una Mattina,Nuvole Bianche,Ludovico Einaudi,Una Mattina,https://audio-ssl.itunes.apple.com/itunes-assets/AudioPreview221/v4/e4/10/58/e4105877-36b9-3972-8e1f-7ab1a0582ada/mzaf_6655221370238140447.plus.aac.p.m4a,https://is1-ssl.mzstatic.com/image/thumb/Music125/v4/ea/44/86/ea448600-257f-670f-7f06-332e02b42abc/06UMGIM59381.rgb.jpg/600x600bb.jpg,https://music.apple.com/us/album/nuvole-bianche/1440762051?i=1440762319&uo=4,itunes
n盲ra::najma wallin,False,N盲ra Najma Wallin N盲ra,,,,,,,itunes
o holy night::flower face,True,O Holy Night Flower Face O Holy Night,O Holy Night,The Holiday Place & Flower Face,O Holy Night - Single,https://audio-ssl.itunes.apple.com/itunes-assets/AudioPreview112/v4/6c/d4/35/6cd43501-5bb4-a97f-56b9-dff319c40064/mzaf_8453760833294389113.plus.aac.p.m4a,https://is1-ssl.mzstatic.com/image/thumb/Music211/v4/fd/02/89/fd028971-8afd-3b8a-62e9-6732b610b949/067003395663.png/600x600bb.jpg,https://music.apple.com/us/album/o-holy-night/1647381272?i=1647381282&uo=4,itunes
o matuto se apaixonou::vitor fernandes,False,O Matuto se Apaixonou Vitor Fernandes #REIDOPISEIRO: 2020.1,,,,,,,itunes
ocean breathes salty::pickin' on series iron horse,False,Ocean Breathes Salty Pickin' On Series Iron Horse Pickin' on Modest Mouse,,,,,,,itunes
ocean white noise::ocean sounds calm sea sounds,False,Ocean White Noise Ocean Sounds Calm Sea Sounds Ocean Waves & Sounds Of The Sea,,,,,,,itunes
ocidentes acontecem::nomade orquestra edgar,False,"Ocidentes Acontecem Nomade Orquestra Edgar Vox Populi, Vol. 1",,,,,,,itunes
odd harmonics::white noise for babies,False,Odd Harmonics White Noise for Babies Thinned Phaser,,,,,,,itunes
oh caroline::the 1975,True,Oh Caroline The 1975 Being Funny In A Foreign Language,Oh Caroline,The 1975,Being Funny In A Foreign Language,https://audio-ssl.itunes.apple.com/itunes-assets/AudioPreview221/v4/20/62/fe/2062fe93-2715-5d15-e887-69df1e0e8840/mzaf_16453407128975774468.plus.aac.p.m4a,https://is1-ssl.mzstatic.com/image/thumb/Music221/v4/1f/c7/98/1fc7988e-0a39-5724-1390-e45246250e24/198704825934_Cover.jpg/600x600bb.jpg,https://music.apple.com/us/album/oh-caroline/1850018862?i=1850018876&uo=4,itunes
"oh, atlanta - live from the louisville palace, kentucky / 2002::alison krauss & union station",False,"Oh, Atlanta - Live From The Louisville Palace, Kentucky / 2002 Alison Krauss & Union Station Live",,,,,,,itunes
ojos color sol (feat. silvio rodr铆guez)::calle 13 silvio rodr铆guez,False,Ojos Color Sol (feat. Silvio Rodr铆guez) Calle 13 Silvio Rodr铆guez MultiViral,,,,,,,itunes
okay::jassie z,False,okay jassie z okay,,,,,,,itunes
old coffee::wavcrush,False,old coffee wavcrush would grain,,,,,,,itunes
old man::the wailin' jennys,False,Old Man The Wailin' Jennys 40 Days,,,,,,,itunes
old number seven::the devil makes three,False,Old Number Seven The Devil Makes Three The Devil Makes Three,,,,,,,itunes
old ties and companions::watchhouse,False,Old Ties and Companions Watchhouse Such Jubilee,,,,,,,itunes
omen::the prodigy,False,Omen The Prodigy Invaders Must Die,,,,,,,itunes
on & on - original mega::jesse saunders,False,On & On - Original Mega Jesse Saunders 20th Anniversary Of House Music Vol. 1: On And On,,,,,,,itunes
on the cloud::dghtr,False,On The Cloud DGHTR On the Cloud,,,,,,,itunes
on the nature of daylight::max richter louisa fuller natalia bonner john metcalfe philip sheppard chris worsey,True,On the Nature of Daylight Max Richter Louisa Fuller Natalia Bonner John Metcalfe Philip Sheppard Chris Worsey The Blue Notebooks (15 Years),On The Nature Of Daylight,"Max Richter, Louisa Fuller, Natalia Bonner, John Metcalfe, Philip Sheppard & Chris Worsey",The Blue Notebooks (15 Years),https://audio-ssl.itunes.apple.com/itunes-assets/AudioPreview126/v4/e4/ce/be/e4cebe4d-e128-c149-d3c3-e863c12e5b03/mzaf_3541492753066162998.plus.aac.p.m4a,https://is1-ssl.mzstatic.com/image/thumb/Music115/v4/58/ec/d7/58ecd75d-8df8-c05f-5e1a-b144292c6493/17UM1IM64259.rgb.jpg/600x600bb.jpg,https://music.apple.com/us/album/on-the-nature-of-daylight/1368089903?i=1368090483&uo=4,itunes
once upon a dream::disney peaceful piano disney,False,Once Upon a Dream Disney Peaceful Piano Disney Disney Peaceful Piano: Lullaby,,,,,,,itunes
one night in tokyo::beast in black,False,One Night in Tokyo Beast In Black Dark Connection,,,,,,,itunes
one too many mornings::the chemical brothers,False,One Too Many Mornings The Chemical Brothers Exit Planet Dust,,,,,,,itunes
one two tree::joi casette,False,One Two Tree Joi Casette One Two Tree,,,,,,,itunes
only love can hurt like this::meg birch,False,Only Love Can Hurt Like This Meg Birch Life Sucks Playlist,,,,,,,itunes
ons::huma,False,Ons Huma Ons,,,,,,,itunes
onslaught - fjaak remix::robert hood claude young fjaak,False,Onslaught - FJAAK Remix Robert Hood Claude Young FJAAK FJAAK 002,,,,,,,itunes
ontario::novo amor ed tullett lowswimmer,True,Ontario Novo Amor Ed Tullett Lowswimmer Heiress,Ontario,Lowswimmer & Novo Amor,Heiress,https://audio-ssl.itunes.apple.com/itunes-assets/AudioPreview126/v4/60/4b/af/604baf88-ac51-93aa-bfca-feab6395ff3d/mzaf_7875196259876360463.plus.aac.p.m4a,https://is1-ssl.mzstatic.com/image/thumb/Music126/v4/6b/40/cd/6b40cd82-35f8-e533-c0ca-5fc4a12d323e/cover.jpg/600x600bb.jpg,https://music.apple.com/us/album/ontario/1674540001?i=1674540441&uo=4,itunes
otherside::red hot chili peppers,False,Otherside Red Hot Chili Peppers Californication (Deluxe Edition),,,,,,,itunes
out of control::the chemical brothers,False,Out Of Control The Chemical Brothers Surrender,,,,,,,itunes
out of my league::stephen speaks,True,Out of My League Stephen Speaks No More Doubt,Out of My League,Stephen Speaks,No More Doubt - EP,https://audio-ssl.itunes.apple.com/itunes-assets/AudioPreview116/v4/fc/ea/18/fcea18be-a639-260c-03c8-fc1a0fdc785e/mzaf_5133595906591051768.plus.aac.p.m4a,https://is1-ssl.mzstatic.com/image/thumb/Music126/v4/40/b7/f6/40b7f6c3-afaa-a3e3-96ef-d53001657bdd/cover.jpg/600x600bb.jpg,https://music.apple.com/us/album/out-of-my-league/1604872031?i=1604872290&uo=4,itunes
out of order::tzeri,False,Out Of Order Tzeri Out Of Order,,,,,,,itunes
out of space::the prodigy,False,Out of Space The Prodigy Experience,,,,,,,itunes
outer level::aaron smith alicia campbell,False,Outer Level Aaron Smith Alicia Campbell Outer Level,,,,,,,itunes
outro lugar::detonautas roque clube,False,Outro Lugar Detonautas Roque Clube Detonautas Ac煤stico,,,,,,,itunes
overnight sensation::accept,False,Overnight Sensation Accept Too Mean to Die,,,,,,,itunes
overwhelming::project aer v i v,True,Overwhelming Project AER v i v How Are You? I'm Okay,Overwhelming,Project AER & v i v,How Are You? I'm Okay,https://audio-ssl.itunes.apple.com/itunes-assets/AudioPreview122/v4/2d/7e/b1/2d7eb163-e734-e04d-444c-32a98128b8c3/mzaf_12480361635129533903.plus.aac.p.m4a,https://is1-ssl.mzstatic.com/image/thumb/Music112/v4/9f/22/d8/9f22d89f-ce86-4946-9980-e2bd89964bd6/1963620973521_cover.jpg/600x600bb.jpg,https://music.apple.com/us/album/overwhelming/1647475862?i=1647475873&uo=4,itunes
painkiller::freestylers,False,Painkiller Freestylers Adventures In Freestyle,,,,,,,itunes
paisaje::malena muyala fabi谩n marquisio,False,Paisaje Malena Muyala Fabi谩n Marquisio Paisaje,,,,,,,itunes
palermo's grunch::los pira帽as,False,Palermo's Grunch Los Pira帽as Historia natural,,,,,,,itunes
palms of victory::ralph stanley,False,Palms Of Victory Ralph Stanley Shine On,,,,,,,itunes
pandemic - live in wacken 2017::accept,False,Pandemic - Live in Wacken 2017 Accept Symphonic Terror (Live at Wacken 2017),,,,,,,itunes
pano::zack tabudlo,True,Pano Zack Tabudlo Pano,Pano,Zack Tabudlo,Pano - Single,https://audio-ssl.itunes.apple.com/itunes-assets/AudioPreview126/v4/41/76/27/417627ec-544e-2fa0-f323-d170a720417a/mzaf_8351637792344904158.plus.aac.p.m4a,https://is1-ssl.mzstatic.com/image/thumb/Music126/v4/a9/d1/e3/a9d1e357-114d-35ba-0373-346f360007e1/21UM1IM48862.rgb.jpg/600x600bb.jpg,https://music.apple.com/us/album/pano/1597221770?i=1597221776&uo=4,itunes
papua new guinea (monsoon mix)::the future sound of london,False,Papua New Guinea (Monsoon Mix) The Future Sound Of London Accelerator Deluxe,,,,,,,itunes
parada louca (feat. mari fernandez)::marcynho sensa莽茫o mari fernandez,False,Parada Louca (feat. Mari Fernandez) Marcynho Sensa莽茫o Mari Fernandez Barra de S茫o Miguel 2022,,,,,,,itunes
paraquedas::gabriel diniz jorge & mateus,False,Paraquedas Gabriel Diniz Jorge & Mateus Paraquedas,,,,,,,itunes
paris night::george bruns,False,Paris Night George Bruns Walt Disney Records The Legacy Collection: The Aristocats,,,,,,,itunes
"part of your world - from ""the little mermaid"" / soundtrack version::jodi benson disney",False,"Part of Your World - From ""The Little Mermaid"" / Soundtrack Version Jodi Benson Disney The Little Mermaid",,,,,,,itunes
part of your world::jodi benson disney,False,Part of Your World Jodi Benson Disney The Little Mermaid Special Edition,,,,,,,itunes
pasional::jorge falc贸n,False,Pasional Jorge Falc贸n Mis 30 Mejores Tangos,,,,,,,itunes
passenger seat::stephen speaks,False,Passenger Seat Stephen Speaks Passenger Seat,,,,,,,itunes
patiently::juno reed,False,Patiently Juno Reed Patiently,,,,,,,itunes
patricinha::jap茫ozin,False,Patricinha Jap茫ozin Arrai谩 pra Pared茫o,,,,,,,itunes
payday::crate diggers,False,Payday Crate Diggers The Cat's Meow,,,,,,,itunes
peaceful patterns::hatha priya,False,Peaceful Patterns Hatha Priya Peaceful Patterns,,,,,,,itunes
peach sky::moodula,False,Peach Sky Moodula Echo Cliff,,,,,,,itunes
people change::mipso,False,People Change Mipso Edges Run,,,,,,,itunes
percolator - jamie jones vault mix::cajmere jamie jones,False,Percolator - Jamie Jones Vault Mix Cajmere Jamie Jones Too Underground For The Main Stage,,,,,,,itunes
perfect natural white noise as a relaxing ambient sleep aid (nice lullaby)::white noise baby sleep,False,Perfect Natural White Noise as a Relaxing Ambient Sleep Aid (Nice Lullaby) White Noise Baby Sleep White Noise for Sleeping Babies,,,,,,,itunes
pero::zack tabudlo,False,Pero Zack Tabudlo Pero,,,,,,,itunes
philosophy by numbers::orbital,False,Philosophy by Numbers Orbital Snivilization,,,,,,,itunes
photograph::boyce avenue bea miller,True,"Photograph Boyce Avenue Bea Miller Cover Sessions, Vol. 4",Photograph (feat. Bea Miller),Boyce Avenue,"Cover Sessions, Vol. 4",https://audio-ssl.itunes.apple.com/itunes-assets/AudioPreview125/v4/31/9f/2e/319f2e82-85ef-342e-79b5-559eddfde60b/mzaf_15134256222325615379.plus.aac.p.m4a,https://is1-ssl.mzstatic.com/image/thumb/Music125/v4/40/ba/0c/40ba0c19-e901-81f3-c7bc-4a4b202d5ba5/2429825.jpg/600x600bb.jpg,https://music.apple.com/us/album/photograph-feat-bea-miller/1369347433?i=1369347627&uo=4,itunes
pianos of gold - ian pooley mix::jovonn ian pooley,False,Pianos of Gold - Ian Pooley Mix Jovonn Ian Pooley Goldtone Edits,,,,,,,itunes
pieces of you::ben sollee,False,Pieces of You Ben Sollee Ben Sollee and Kentucky Native,,,,,,,itunes
pimp::bacao rhythm & steel band,False,PIMP Bacao Rhythm & Steel Band 55,,,,,,,itunes
pipistrela::tita merello francisco canaro y su orquesta tipica,False,Pipistrela Tita Merello Francisco Canaro Y Su Orquesta Tipica Serie De Oro,,,,,,,itunes
piseiro com balada::vitinho imperador brisa star,False,Piseiro com Balada Vitinho Imperador Brisa Star Piseiro com Balada,,,,,,,itunes
planeta de cores::forroz茫o tropykalia,False,"Planeta de Cores Forroz茫o Tropykalia Campe玫es do Forr贸, Vol. 04",,,,,,,itunes
